{"admission_file_sha256":"5f5b3cf6f778ad0a3aee58e48ff248469699d2aaa8884efdad48277ec7175872","admission_receipt_sha256":"8a3868f1daa98326186541c368a14bf28b86e4df85180e3198dfd4fa6b456efe","appearance_diagnostics":[{"appearance_id":"cool_sensor","locally_separable":false,"obstruction_count":2700,"obstruction_probability":{"maximum":0.992953360080719,"mean":0.8547950983047485,"median":0.8786110877990723,"minimum":0.11944841593503952},"separation_margin":-0.8009985089302063,"visible_count":900,"visible_probability":{"maximum":0.9204469323158264,"mean":0.3788891136646271,"median":0.3212684988975525,"minimum":0.027883965522050858}},{"appearance_id":"high_key","locally_separable":false,"obstruction_count":2700,"obstruction_probability":{"maximum":0.9924612641334534,"mean":0.8082987070083618,"median":0.8430956602096558,"minimum":0.1253935843706131},"separation_margin":-0.7775527834892273,"visible_count":900,"visible_probability":{"maximum":0.9029463529586792,"mean":0.3297754228115082,"median":0.3018089234828949,"minimum":0.018381869420409203}},{"appearance_id":"low_key","locally_separable":false,"obstruction_count":2700,"obstruction_probability":{"maximum":0.9893229603767395,"mean":0.8171927332878113,"median":0.8410911560058594,"minimum":0.061279281973838806},"separation_margin":-0.7988349199295044,"visible_count":900,"visible_probability":{"maximum":0.8601142168045044,"mean":0.2807334363460541,"median":0.17832845449447632,"minimum":0.018505064770579338}},{"appearance_id":"neutral","locally_separable":false,"obstruction_count":2700,"obstruction_probability":{"maximum":0.9920533895492554,"mean":0.7622954845428467,"median":0.7965890765190125,"minimum":0.07530058175325394},"separation_margin":-0.7871459126472473,"visible_count":900,"visible_probability":{"maximum":0.8624464869499207,"mean":0.277870237827301,"median":0.2184814065694809,"minimum":0.016228005290031433}}],"checkpoint_changed":false,"development_count":14400,"development_probability_sha256":"00e6107c0c74b2282e0d424507c68be367d4e0dc67dbfd140372b5c44671bc0d","evaluation_opened":false,"family_diagnostics":[{"count":2400,"expected_decision":"ABSTAIN","family":"CABLE","probability":{"maximum":0.9494661092758179,"mean":0.6730726361274719,"median":0.7032573223114014,"minimum":0.061279281973838806}},{"count":2400,"expected_decision":"VISIBLE","family":"DISTRACTOR","probability":{"maximum":0.8875974416732788,"mean":0.19884197413921356,"median":0.11710380017757416,"minimum":0.016228005290031433}},{"count":1200,"expected_decision":"ABSTAIN","family":"FOREIGN_OBJECT","probability":{"maximum":0.9531095623970032,"mean":0.7668048739433289,"median":0.7811477184295654,"minimum":0.3168298304080963}},{"count":4800,"expected_decision":"ABSTAIN","family":"IMAGE_QUALITY","probability":{"maximum":0.992953360080719,"mean":0.9218282103538513,"median":0.9482975602149963,"minimum":0.5865961313247681}},{"count":1200,"expected_decision":"VISIBLE","family":"NONE","probability":{"maximum":0.9204469323158264,"mean":0.5527672171592712,"median":0.5485175848007202,"minimum":0.13356992602348328}},{"count":2400,"expected_decision":"ABSTAIN","family":"TOOL","probability":{"maximum":0.9561163187026978,"mean":0.7477730512619019,"median":0.7671067714691162,"minimum":0.31183046102523804}}],"fixture_bundle_sha256":"7e861cb17b5f4717d732989d1ddaaeb4ab3e3e4e0ae1d92dd19de35afa397fed","fixture_file_sha256":"56b04e0bcc35c26eea2848a0244827d7285e5056667f17deae628c0986921cbd","global_probability":{"obstruction":{"maximum":0.992953360080719,"mean":0.8106454610824585,"median":0.8458081483840942,"minimum":0.061279281973838806},"visible":{"maximum":0.9204469323158264,"mean":0.316817045211792,"median":0.259745329618454,"minimum":0.016228005290031433}},"hardware_writes":0,"limitations":["This diagnostic reuses consumed synthetic development evidence and cannot evaluate a successor","The camera, materials, and obstruction geometry remain synthetic and unmeasured","Probability attribution may guide a fresh predeclaration but cannot qualify deployment"],"lineage_file_sha256":"42b90b96ad200d5ac4077973cb3d4ce5523c061cda3cbd15e9f6c227d6f2694d","model_file_sha256":"f84dc5e4c675dfac2533bf51e3101f0b4eab1c2dd36850c80cfdd6b4f59c7a26","pairwise_auc":0.9459893261316873,"physical_authority":false,"physical_movements":0,"report_sha256":"75043c46e7d49c7861f4c0c32acd5b471a10df35acf17c7cc924f6b5ab608804","scene_diagnostics":[{"locally_separable":false,"obstruction_count":2700,"obstruction_probability":{"maximum":0.992953360080719,"mean":0.809964656829834,"median":0.8378044962882996,"minimum":0.15113398432731628},"scene_id":"residual_development_scene_01","separation_margin":-0.7364356517791748,"visible_count":900,"visible_probability":{"maximum":0.8875696659088135,"mean":0.31346943974494934,"median":0.26463860273361206,"minimum":0.01990670897066593}},{"locally_separable":false,"obstruction_count":2700,"obstruction_probability":{"maximum":0.9922580122947693,"mean":0.8034881353378296,"median":0.8386789560317993,"minimum":0.07044534385204315},"scene_id":"residual_development_scene_02","separation_margin":-0.80284583568573,"visible_count":900,"visible_probability":{"maximum":0.8732911944389343,"mean":0.30746492743492126,"median":0.23681190609931946,"minimum":0.016228005290031433}},{"locally_separable":false,"obstruction_count":2700,"obstruction_probability":{"maximum":0.9922831654548645,"mean":0.8032582998275757,"median":0.8273018598556519,"minimum":0.22283273935317993},"scene_id":"residual_development_scene_03","separation_margin":-0.6662779450416565,"visible_count":900,"visible_probability":{"maximum":0.8891106843948364,"mean":0.3156382143497467,"median":0.2702100872993469,"minimum":0.021521983668208122}},{"locally_separable":false,"obstruction_count":2700,"obstruction_probability":{"maximum":0.9926146268844604,"mean":0.8258707523345947,"median":0.8723024129867554,"minimum":0.061279281973838806},"scene_id":"residual_development_scene_04","separation_margin":-0.8591676354408264,"visible_count":900,"visible_probability":{"maximum":0.9204469323158264,"mean":0.33069559931755066,"median":0.2575874328613281,"minimum":0.019324971362948418}}],"schema":"tactevra.ai_residual_obstruction_v3_diagnostic.v1","scope":"CONSUMED_SYNTHETIC_ISAAC_DEVELOPMENT_DIAGNOSTIC_NO_QUALIFICATION","scorecard_file_sha256":"e640fabd7023742bb6ce13a4bd1aabd245b0ad94a9ec9d0f339086e94c4f9c52","scorecard_result_sha256":"a9cad85e3ac389c81af5117125d61cc9ca1ae94ff9d382a64f34f1987fd35b05","target_diagnostics":[{"locally_separable":false,"obstruction_count":144,"obstruction_probability":{"maximum":0.9879846572875977,"mean":0.8614736795425415,"median":0.8772908449172974,"minimum":0.5442357659339905},"separation_margin":-0.34492653608322144,"target_id":"keyboard:0","visible_count":48,"visible_probability":{"maximum":0.8891623020172119,"mean":0.2750517427921295,"median":0.12898311018943787,"minimum":0.04778571054339409}},{"locally_separable":false,"obstruction_count":144,"obstruction_probability":{"maximum":0.9880200028419495,"mean":0.8478883504867554,"median":0.8705142140388489,"minimum":0.38354557752609253},"separation_margin":-0.4817189574241638,"target_id":"keyboard:1","visible_count":48,"visible_probability":{"maximum":0.8652645349502563,"mean":0.34703969955444336,"median":0.21362222731113434,"minimum":0.059563007205724716}},{"locally_separable":false,"obstruction_count":144,"obstruction_probability":{"maximum":0.9903724193572998,"mean":0.8963652849197388,"median":0.9025151133537292,"minimum":0.6733894944190979},"separation_margin":-0.20615923404693604,"target_id":"keyboard:2","visible_count":48,"visible_probability":{"maximum":0.8795487284660339,"mean":0.3291345536708832,"median":0.19036364555358887,"minimum":0.06244562938809395}},{"locally_separable":false,"obstruction_count":144,"obstruction_probability":{"maximum":0.9896942377090454,"mean":0.8574140667915344,"median":0.8764527440071106,"minimum":0.4686107635498047},"separation_margin":-0.38056033849716187,"target_id":"keyboard:3","visible_count":48,"visible_probability":{"maximum":0.8491711020469666,"mean":0.3144894242286682,"median":0.1422414928674698,"minimum":0.046917181462049484}},{"locally_separable":false,"obstruction_count":144,"obstruction_probability":{"maximum":0.9881744384765625,"mean":0.8419851660728455,"median":0.8595043420791626,"minimum":0.414017915725708},"separation_margin":-0.23451417684555054,"target_id":"keyboard:4","visible_count":48,"visible_probability":{"maximum":0.6485320925712585,"mean":0.2294466495513916,"median":0.13433335721492767,"minimum":0.049319781363010406}},{"locally_separable":false,"obstruction_count":144,"obstruction_probability":{"maximum":0.9880183935165405,"mean":0.8307411670684814,"median":0.8576209545135498,"minimum":0.42913809418678284},"separation_margin":-0.3008442223072052,"target_id":"keyboard:5","visible_count":48,"visible_probability":{"maximum":0.729982316493988,"mean":0.26548632979393005,"median":0.1505012810230255,"minimum":0.039346907287836075}},{"locally_separable":false,"obstruction_count":144,"obstruction_probability":{"maximum":0.9884015917778015,"mean":0.8881875276565552,"median":0.9005376100540161,"minimum":0.5958007574081421},"separation_margin":-0.2165607213973999,"target_id":"keyboard:6","visible_count":48,"visible_probability":{"maximum":0.812361478805542,"mean":0.3054320812225342,"median":0.16317301988601685,"minimum":0.04889862239360809}},{"locally_separable":false,"obstruction_count":144,"obstruction_probability":{"maximum":0.9898843765258789,"mean":0.8651888370513916,"median":0.8755542039871216,"minimum":0.39608678221702576},"separation_margin":-0.44843801856040955,"target_id":"keyboard:7","visible_count":48,"visible_probability":{"maximum":0.8445248007774353,"mean":0.3152414858341217,"median":0.1318342238664627,"minimum":0.048959821462631226}},{"locally_separable":false,"obstruction_count":144,"obstruction_probability":{"maximum":0.9881321787834167,"mean":0.8312138319015503,"median":0.8654372692108154,"minimum":0.3146352469921112},"separation_margin":-0